{
  "brand_id": "ana",
  "brand_name": "En la Galería de Ana",
  "business_unit": "Fotografía de bodas",
  "active_status": true,
  "facebook_page_id": "PLACEHOLDER_ANA_FACEBOOK_PAGE_ID",
  "instagram_business_id": "PLACEHOLDER_ANA_IG_BUSINESS_ID",
  "whatsapp_waba_id": "PLACEHOLDER_ANA_WABA_ID",
  "whatsapp_phone_number_id": "PLACEHOLDER_ANA_PHONE_NUMBER_ID",
  "meta_ad_account_id": "PLACEHOLDER_ANA_AD_ACCOUNT_ID",
  "crm_sheet_id": "PLACEHOLDER_ANA_GOOGLE_SHEET_ID",
  "default_language": "es",
  "tone_profile": "Emocional, elegante, sensible, claro, humano. Como si Ana respondiera personalmente. Sin sonar genérico ni como bot. No presionar a novias.",
  "services": [
    "Fotografía de bodas en Panamá",
    "Cobertura completa del día de la boda",
    "Sesiones de pre-boda (engagement)",
    "Álbumes y galería digital"
  ],
  "pricing_rules": {
    "can_auto_share_prices": false,
    "requires_human_for_quote": true,
    "notes": "Nunca dar precio sin conocer fecha, lugar y tipo de cobertura. El precio lo define Ana o Ricardo. El sistema solo puede decir 'tenemos paquetes desde X' si eso está explícitamente autorizado."
  },
  "human_approval_required_for": [
    "precio",
    "cotizacion",
    "descuento",
    "contrato",
    "reserva",
    "reclamo",
    "campaign_change"
  ],
  "allowed_automations": [
    "intent_classification",
    "lead_scoring",
    "initial_response_generic",
    "portafolio_sharing",
    "campaign_reporting",
    "followup_D1_soft",
    "followup_D3_value"
  ],
  "blocked_automations": [
    "price_quoting",
    "campaign_modification",
    "contract_sending",
    "cold_dm",
    "aggressive_followup"
  ],
  "responsible_users": ["Ricardo", "Ana"],
  "escalation_channels": {
    "whatsapp": "PLACEHOLDER_RICARDO_WHATSAPP",
    "email": "kmediafilms@gmail.com",
    "n8n_notification": true
  }
}
